{
  "schema_version": 1,
  "revision": 0,
  "name": "Falling box acceptance scene",
  "gravity": [0.0, -9.81, 0.0],
  "fixed_dt": 0.016666668,
  "bodies": [
    {
      "id": "floor",
      "motion": "static",
      "shape": {"type": "box", "half_extents": [10.0, 0.5, 10.0]},
      "position": [0.0, -0.5, 0.0]
    },
    {
      "id": "box",
      "motion": "dynamic",
      "shape": {"type": "box", "half_extents": [0.5, 0.5, 0.5]},
      "position": [0.0, 5.0, 0.0],
      "mass": 1.0
    }
  ],
  "checks": [
    {"kind": "position", "body": "box", "min": [-0.1, 0.45, -0.1], "max": [0.1, 0.55, 0.1]},
    {"kind": "speed", "body": "box", "max": 0.1}
  ]
}
