{
  "schema_version": 1,
  "revision": 0,
  "name": "Primitive renderer acceptance scene",
  "gravity": [0, -9.81, 0],
  "fixed_dt": 0.016666668,
  "bodies": [
    {"id": "floor", "motion": "static", "shape": {"type": "box", "half_extents": [4, 0.25, 3]}, "position": [0, -0.25, 0]},
    {"id": "cube", "motion": "dynamic", "shape": {"type": "box", "half_extents": [0.7, 0.7, 0.7]}, "position": [-1.9, 0.7, 0], "rotation": [0, 0.38268343, 0, 0.9238795]},
    {"id": "sphere", "motion": "dynamic", "shape": {"type": "sphere", "radius": 0.8}, "position": [0.1, 0.8, 0]},
    {"id": "pillar", "motion": "kinematic", "shape": {"type": "box", "half_extents": [0.45, 1.4, 0.45]}, "position": [2, 1.4, 0], "rotation": [0, -0.25881904, 0, 0.9659258]}
  ],
  "checks": [
    {"kind": "position", "body": "sphere", "min": [-0.1, 0.75, -0.1], "max": [0.3, 0.85, 0.1]},
    {"kind": "speed", "body": "cube", "max": 0.1}
  ]
}
